Sheet: IRS f1040
A1: Form 1040 2024 U.S. Individual Income Tax Return
A2: Department of the TreasuryInternal Revenue Service
A4: 1a | B4: Total amount from Form(s) W-2, box 1 (see instructions) | I4: 1a | J4: of:=[$W2.D6] -> 0
A5: 1b | B5: Household employee wages not reported on Form(s) W-2 | I5: 1b
A6: 1c | B6: Tip income not reported on line 1a (see instructions) | I6: 1c
A7: 1d | B7: Medicaid waiver payments not reported on Form(s) W-2 (see instructions) | I7: 1d
A8: 1e | B8: Taxable dependent care benefits from Form 2441, line 26 | I8: 1e
A9: 1f | B9: Employer-provided adoption benefits from Form 8839, line 29 | I9: 1f
A10: 1g | B10: Wages from Form 8919, line 6 | I10: 1g
A11: 1h | B11: Other earned income (see instructions) | I11: 1h
A12: 1i | B12: Nontaxable combat pay election (see instructions) | G12: 1i
A13: 1z | B13: Add lines 1a through 1h | I13: 1z | J13: of:=SUM([.J4:.J11]) -> 0
A14: 2a | B14: Tax-exempt interest | G14: 2a
A15: 2b | B15: Taxable interest | I15: 2b
A16: 3a | B16: Qualified dividends | G16: 3a
A17: 3b | B17: Ordinary dividends | I17: 3b
A18: 4a | B18: IRA distributions | G18: 4a
A19: 4b | B19: Taxable amount | I19: 4b
A20: 5a | B20: Pensions and annuities | G20: 5a
A21: 5b | B21: Taxable amount | I21: 5b
A22: 6a | B22: Social security benefits | G22: 6a
A23: 6b | B23: Taxable amount | I23: 6b
A24: 7 | B24: Capital gain or (loss). Attach Schedule D if required. If not required, check here | I24: 7
A25: 8 | B25: Additional income from Schedule 1, line 10 | I25: 8 | J25: of:=[$'IRS f1040 S1'.J37] -> 0
A26: 9 | B26: Add lines 1z, 2b, 3b, 4b, 5b, 6b, 7, and 8. This is your total income | I26: 9 | J26: of:=SUM([.J13:.J25]) -> 0
A27: 10 | B27: Adjustments to income from Schedule 1, line 26 | I27: 10 | J27: of:=[$'IRS f1040 S1'.J69] -> 0
A28: 11 | B28: Subtract line 10 from line 9. This is your adjusted gross income | I28: 11 | J28: of:=[.J26]-[.J27] -> 0
A29: Standard Deduction for {
A30: - Single or Married filing separately: $14,600
A31: - Married filing jointly or Qualifying surviving spouse: $29,200
A32: - Head of household: $21,900}
A33: 12 | B33: Standard deduction or itemized deductions (from Schedule A) | I33: 12
A34: 13 | B34: Qualified business income deduction from Form 8995 or Form 8995-A | I34: 13
A35: 14 | B35: Add lines 12 and 13 | I35: 14 | J35: of:=SUM([.J33:.J34]) -> 0
A36: 15 | B36: Subtract line 14 from line 11. If zero or less, enter -0-. This is your taxable income | I36: 15 | J36: of:=[.J28]-[.J35] -> 0
A38: Form 1040 (2023) Page 2
A39: Tax and Credits
A40: 16 | B40: Tax (see instructions). Check if any from Form(s): 1 8814 2 4972 3 | I40: 16
A41: 17 | B41: Amount from Schedule 2, line 3 | I41: 17 | J41: of:=[$'IRS f1040 S2'.J20] -> 0
A42: 18 | B42: Add lines 16 and 17 | I42: 18 | J42: of:=[.J40]+[.J41] -> 0
A43: 19 | B43: Child tax credit or credit for other dependents from Schedule 8812 | I43: 19
A44: 20 | B44: Amount from Schedule 3, line 8 | I44: 20 | J44: of:=[$'IRS f1040 S3'.F25] -> 0
A45: 21 | B45: Add lines 19 and 20 | I45: 21 | J45: of:=[.J43]+[.J44] -> 0
A46: 22 | B46: Subtract line 21 from line 18. If zero or less, enter -0- | I46: 22 | J46: of:=MAX([.J42]-[.J45];0) -> 0
A47: 23 | B47: Other taxes, including self-employment tax, from Schedule 2, line 21 | I47: 23 | J47: of:=[$'IRS f1040 S2'.J60] -> 0
A48: 24 | B48: Add lines 22 and 23. This is your total tax | I48: 24 | J48: of:=[.J46]+[.J47] -> 0
A49: Payments
A50: 25a | B50: Form(s) W-2 | G50: 25a | H50: of:=[$W2.D7] -> 0
A51: 25b | B51: Form(s) 1099 | G51: 25b
A52: 25c | B52: Other forms (see instructions) | G52: 25c
A53: 25d | B53: Add lines 25a through 25c | I53: 25d | J53: of:=SUM([.H50:.H52]) -> 0
A54: 26 | B54: 2023 estimated tax payments and amount applied from 2022 return | I54: 26
A55: 27 | B55: Earned income credit (EIC) | G55: 27
A56: 28 | B56: Additional child tax credit from Schedule 8812 | G56: 28
A57: 29 | B57: American opportunity credit from Form 8863, line 8 | G57: 29
A58: 30 | B58: Reserved for future use | G58: 30
A59: 31 | B59: Amount from Schedule 3, line 15 | G59: 31 | H59: of:=[$'IRS f1040 S3'.F40] -> 0
A60: 32 | B60: Add lines 27, 28, 29, and 31. These are your total other payments and refundable credits | I60: 32 | J60: of:=SUM([.H55:.H59]) -> 0
A61: 33 | B61: Add lines 25d, 26, and 32. These are your total payments | I61: 33 | J61: of:=SUM([.J53:.J60]) -> 0
A62: Refund
A63: 34 | B63: If line 33 is more than line 24, subtract line 24 from line 33. This is the amount you overpaid | I63: 34 | J63: of:=[.J61]-[.J48] -> 0
A64: 35a | B64: Amount of line 34 you want refunded to you. If Form 8888 is attached, check here | I64: 35a | J64: of:=[.J63] -> 0
A65: 36 | B65: Amount of line 34 you want applied to your 2024 estimated tax | G65: 36 | H65: of:=[.J63]-[.J64] -> 0
A66: Amount You Owe
A67: 37 | B67: Subtract line 33 from line 24. This is the amount you owe | I67: 37 | J67: of:=[.J48]-[.J61] -> 0
A68: 38 | B68: Estimated tax penalty (see instructions) | G68: 38

Sheet: W2
A1: Form W-2
A3: Employee Name
A4: Employer Name
A6: 1. | B6: Wages, tips, other compensation | C6: 1.
A7: 2. | B7: Federal income tax withheld | C7: 2.
A8: 3. | B8: Social security wages | C8: 3.
A9: 4. | B9: Social security tax withheld | C9: 4.
A10: 5. | B10: Medicare wages and tips | C10: 5.
A11: 6. | B11: Medicare tax withheld | C11: 6.
A12: 7. | B12: Social security tips | C12: 7.
A13: 8. | B13: Allocated tips | C13: 8.
A14: 9. | C14: 9.
A15: 10. | B15: Dependent care benefits | C15: 10.
A16: 11. | B16: Nonqualified plans | C16: 11.
A17: 12a. | C17: 12a.
A18: 12b. | C18: 12b.
A19: 12c. | C19: 12c.
A20: 12d. | C20: 12d.
A21: of:="13." -> 13. | C21: of:="13." -> 13.
A22: 14. | B22: Other | C22: 14.
A23: 15. | B23: State | C23: 15.
A24: 16. | B24: State wages, tips, etc. | C24: 16.
A25: 17. | B25: State income tax | C25: 17.
A26: 18. | B26: Local wages, tips, etc. | C26: 18.
A27: 19. | B27: Local income tax | C27: 19.
A28: 20. | B28: Locality name | C28: 20.

Sheet: IRS f1040 S1
A1: SCHEDULE 1 (Form 1040)
A2: 2022 Additional Income and Adjustments to Income
A3: Amount reported Form(s) 1099-K that was included in error or for personal items sold at a loss
A4: Part I Additional Income
A5: 1 | B5: Taxable refunds, credits, or offsets of state and local income taxes | I5: 1
A6: 2a | B6: Alimony received | I6: 2a
A7: 3 | B7: Business income or (loss). Attach Schedule C | I7: 3
A8: 4 | B8: Other gains or (losses). Attach Form 4797 | I8: 4
A9: 5 | B9: Rental real estate, royalties, partnerships, S corporations, trusts, etc. Attach Schedule E | I9: 5
A10: 6 | B10: Farm income or (loss). Attach Schedule F | I10: 6
A11: 7 | B11: Unemployment compensation | I11: 7
A12: 8 | B12: Other income:
A13: 8a | B13: Net operating loss | G13: 8a
A14: 8b | B14: Gambling | G14: 8b
A15: 8c | B15: Cancellation of debt | G15: 8c
A16: 8d | B16: Foreign earned income exclusion from Form 2555 | G16: 8d
A17: 8e | B17: Income from Form 8853 | G17: 8e
A18: 8f | B18: Income from Form 8889 | G18: 8f
A19: 8g | B19: Alaska Permanent Fund dividends | G19: 8g
A20: 8h | B20: Jury duty pay | G20: 8h
A21: 8i | B21: Prizes and awards | G21: 8i
A22: 8j | B22: Activity not engaged in for profit income | G22: 8j
A23: 8k | B23: Stock options | G23: 8k
A24: 8l | B24: Income from the rental of personal property if you engaged in the rental for profit but were not in the business of renting such property | G24: 8l
A25: 8m | B25: Olympic and Paralympic medals and USOC prize money (see instructions) | G25: 8m
A26: 8n | B26: Section 951(a) inclusion (see instructions) | G26: 8n
A27: 8o | B27: Section 951A(a) inclusion (see instructions) | G27: 8o
A28: 8p | B28: Section 461(l) excess business loss adjustment | G28: 8p
A29: 8q | B29: Taxable distributions from an ABLE account (see instructions) | G29: 8q
A30: 8r | B30: Scholarship and fellowship grants not reported on Form W-2 | G30: 8r
A31: 8s | B31: Nontaxable amount of Medicaid waiver payments included on Form 1040, line 1a or 1d | G31: 8s
A32: 8t | B32: Pension or annuity from a nonqualifed deferred compensation plan or a nongovernmental section 457 plan | G32: 8t
A33: 8u | B33: Wages earned while incarcerated | G33: 8u
A34: 8v | B34: Digital assets received as ordinary income not reported elsewhere. | G34: 8v
A35: 8z | B35: Other income. List type and amount: | G35: 8z
A36: 9 | B36: Total other income. Add lines 8a through 8z | I36: 9 | J36: of:=SUM([.H13:.H35]) -> 0
A37: 10 | B37: Combine lines 1 through 7 and 9. Enter here and on Form 1040, 1040-SR, or 1040-NR, line 8 | I37: 10 | J37: of:=SUM([.J5:.J36]) -> 0
A39: Page 2
A41: Part II Adjustments to Income
A42: 11 | B42: Educator expenses | I42: 11
A43: 12 | B43: Certain business expenses of reservists, performing artists, and fee-basis government officials. Attach Form 2106 | I43: 12
A44: 13 | B44: Health savings account deduction. Attach Form 8889 | I44: 13
A45: 14 | B45: Moving expenses for members of the Armed Forces. Attach Form 3903 | I45: 14
A46: 15 | B46: Deductible part of self-employment tax. Attach Schedule SE | I46: 15
A47: 16 | B47: Self-employed SEP, SIMPLE, and qualified plans | I47: 16
A48: 17 | B48: Self-employed health insurance deduction | I48: 17
A49: 18 | B49: Penalty on early withdrawal of savings | I49: 18
A50: 19a | B50: Alimony paid | I50: 19a
A51: 20 | B51: IRA deduction | I51: 20
A52: 21 | B52: Student loan interest deduction | I52: 21
A53: 22 | B53: Reserved for future use | I53: 22
A54: 23 | B54: Archer MSA deduction | I54: 23
A55: 24 | B55: Other adjustments:
A56: 24a | B56: Jury duty pay (see instructions) | G56: 24a
A57: 24b | B57: Deductible expenses related to income reported on line 8l from the rental of personal property engaged in for profit | G57: 24b
A58: 24c | B58: Nontaxable amount of the value of Olympic and Paralympic medals and USOC prize money reported on line 8m | G58: 24c
A59: 24d | B59: Reforestation amortization and expenses | G59: 24d
A60: 24e | B60: Repayment of supplemental unemployment benefits under the Trade Act of 1974 | G60: 24e
A61: 24f | B61: Contributions to section 501(c)(18)(D) pension plans | G61: 24f
A62: 24g | B62: Contributions by certain chaplains to section 403(b) plans | G62: 24g
A63: 24h | B63: Attorney fees and court costs for actions involving certain unlawful discrimination claims (see instructions) | G63: 24h
A64: 24i | B64: Attorney fees and court costs you paid in connection with an award from the IRS for information you provided that helped the IRS detect tax law violations | G64: 24i
A65: 24j | B65: Housing deduction from Form 2555 | G65: 24j
A66: 24k | B66: Excess deductions of section 67(e) expenses from Schedule K-1 (Form 1041) | G66: 24k
A67: 24z | B67: Other adjustments. List type and amount: | G67: 24z
A68: 25 | B68: Total other adjustments. Add lines 24a through 24z | I68: 25 | J68: of:=SUM([.H56:.H67]) -> 0
A69: 26 | B69: Add lines 11 through 23 and 25. These are your adjustments to income. Enter here and on Form 1040 or 1040-SR, line 10, or Form 1040-NR, line 10a | I69: 26 | J69: of:=SUM([.J42:.J68]) -> 0

Sheet: IRS f1040 S2
A1: SCHEDULE 2 (Form 1040) 2024
A2: Additional Taxes
A3: Name(s) shown on Form 1040, 1040-SR, or 1040-NR Your social security number
A5: Part I Tax
A6: 1 Additions to tax:
A7: 1a | B7: Excess advance premium tax credit repayment. Attach Form 8962 | G7: 1a
A8: 1b | B8: Repayment of new clean vehicle credit(s) transferred to a registered dealer from Schedule A (Form 8936), Part II. Attach Form 8936 and Schedule A (Form 8936) | G8: 1b
A9: 1c | B9: Repayment of previously owned clean vehicle credit(s) transferred to a registered dealer from Schedule A (Form 8936), Part IV. Attach Form 8936 and Schedule A (Form 8936) | G9: 1c
A10: 1d | B10: Recapture of net EPE from Form 4255, line 2a, column (l) | G10: 1d
A11: 1e | B11: Excessive payments (EP) from Form 4255. Check applicable box and enter amount | G11: 1e
A12: (i) Line 1a, column (n) (ii) Line 1c, column (n)
A13: (iii) Line 1d, column (n) (iv) Line 2a, column (n)
A14: 1f | B14: 20% EP from Form 4255. Check applicable box and enter amount. See instructions | G14: 1f
A15: (i) Line 1a, column (o) (ii) Line 1c, column (o)
A16: (iii) Line 1d, column (o) (iv) Line 2a, column (o)
A17: 1y | B17: Other additions to tax (see instructions): | G17: 1y
A18: 1z | B18: Add lines 1a through 1y | I18: 1z | J18: of:=SUM([.H7:.H11])+[.H14]+[.H17] -> 0
A19: 2 | B19: Alternative minimum tax. Attach Form 6251 | I19: 2
A20: 3 | B20: Add lines 1z and 2. Enter here and on Form 1040, 1040-SR, or 1040-NR, line 17 | I20: 3 | J20: of:=SUM([.J18:.J19]) -> 0
A22: Part II Other Taxes
A23: 4 | B23: Self-employment tax. Attach Schedule SE | I23: 4
A24: 5 | B24: Social security and Medicare tax on unreported tip income. Attach Form 4137 | G24: 5
A25: 6 | B25: Uncollected social security and Medicare tax on wages. Attach Form 8919 | G25: 6
A26: 7 | B26: Total additional social security and Medicare tax. Add lines 5 and 6 | I26: 7 | J26: of:=SUM([.H24:.H25]) -> 0
A27: 8 | B27: Additional tax on IRAs or other tax-favored accounts. Attach Form 5329 if required | I27: 8
A28: 9 | B28: Household employment taxes. Attach Schedule H | I28: 9
A29: 10 | B29: Repayment of first-time homebuyer credit. Attach Form 5405 if required | I29: 10
A30: 11 | B30: Additional Medicare Tax. Attach Form 8959 | I30: 11
A31: 12 | B31: Net investment income tax. Attach Form 8960 | I31: 12
A32: 13 | B32: Uncollected social security and Medicare or RRTA tax on tips or group-term life insurance from Form W-2, box 12 | I32: 13
A33: 14 | B33: Interest on tax due on installment income from the sale of certain residential lots and timeshares | I33: 14
A34: 15 | B34: Interest on the deferred tax on gain from certain installment sales with a sales price over $150,000 | I34: 15
A35: 16 | B35: Recapture of low-income housing credit. Attach Form 8611 | I35: 16
A37: Part II Other Taxes (continued)
A38: 17 Other additional taxes:
A39: 17a | B39: Recapture of other credits. List type, form number, and amount: | G39: 17a
A40: 17b | B40: Recapture of federal mortgage subsidy, if you sold your home see instructions | G40: 17b
A41: 17c | B41: Additional tax on HSA distributions. Attach Form 8889 | G41: 17c
A42: 17d | B42: Additional tax on an HSA because you didnt remain an eligible individual. Attach Form 8889 | G42: 17d
A43: 17e | B43: Additional tax on Archer MSA distributions. Attach Form 8853 | G43: 17e
A44: 17f | B44: Additional tax on Medicare Advantage MSA distributions. Attach Form 8853 | G44: 17f
A45: 17g | B45: Recapture of a charitable contribution deduction related to a fractional interest in tangible personal property | G45: 17g
A46: 17h | B46: Income you received from a nonqualified deferred compensation plan that fails to meet the requirements of section 409A | G46: 17h
A47: 17i | B47: Compensation you received from a nonqualified deferred compensation plan described in section 457A | G47: 17i
A48: 17j | B48: Section 72(m)(5) excess benefits tax | G48: 17j
A49: 17k | B49: Golden parachute payments | G49: 17k
A50: 17l | B50: Tax on accumulation distribution of trusts | G50: 17l
A51: 17m | B51: Excise tax on insider stock compensation from an expatriated corporation | G51: 17m
A52: 17n | B52: Look-back interest under section 167(g) or 460(b) from Form 8697 or 8866 | G52: 17n
A53: 17o | B53: Tax on non-effectively connected income for any part of the year you were a nonresident alien from Form 1040-NR | G53: 17o
A54: 17p | B54: Any interest from Form 8621, line 16f, relating to distributions from, and dispositions of, stock of a section 1291 fund | G54: 17p
A55: 17q | B55: Any interest from Form 8621, line 24 | G55: 17q
A56: 17z | B56: Any other taxes. List type and amount: | G56: 17z
A57: 18 | B57: Total additional taxes. Add lines 17a through 17z | I57: 18 | J57: of:=SUM([.H39:.H56]) -> 0
A58: 19 | B58: Recapture of net EPE from Form 4255, line 1d, column (l) | I58: 19
A59: 20 | B59: Section 965 net tax liability installment from Form 965-A | G59: 20
A60: 21 | B60: Add lines 4, 7 through 16, 18, and 19. These are your total other taxes. Enter here and on Form 1040 or 1040-SR, line 23, or Form 1040-NR, line 23b | I60: 21 | J60: of:=[.J23]+SUM([.J26:.J35])+[.J57]+[.J58] -> 0

Sheet: IRS f1040 S3
A1: SCHEDULE 3 (Form 1040) 2024 Additional Credits and Payments
A2: Part I Nonrefundable Credits
A3: 1 | B3: Foreign tax credit. Attach Form 1116 if required | E3: 1
A4: 2 | B4: Credit for child and dependent care expenses from Form 2441, line 11. Attach Form 2441 | E4: 2
A5: 3 | B5: Education credits from Form 8863, line 19 | E5: 3
A6: 4 | B6: Retirement savings contributions credit. Attach Form 8880 | E6: 4
A7: 5a | B7: Residential energy credits. Attach Form 5695 | E7: 5a
A8: 5b | B8: Energy efficient home improvement credit | E8: 5b
A9: Other nonrefundable credits:
A10: 6a | B10: General business credit. Attach Form 3800 | C10: 6a
A11: 6b | B11: Credit for prior year minimum tax. Attach Form 8801 | C11: 6b
A12: 6c | B12: Adoption credit. Attach Form 8839 | C12: 6c
A13: 6d | B13: Credit for the elderly or disabled. Attach Schedule R | C13: 6d
A14: 6e | B14: Reserved for future use | C14: 6e
A15: 6f | B15: Clean vehicle credit | C15: 6f
A16: 6g | B16: Mortgage interest credit. Attach Form 8396 | C16: 6g
A17: 6h | B17: District of Columbia first-time homebuyer credit. Attach Form 8859 | C17: 6h
A18: 6i | B18: Qualified electric vehicle credit. Attach Form 8834 | C18: 6i
A19: 6j | B19: Alternative fuel vehicle refueling property credit. Attach Form 8911 | C19: 6j
A20: 6k | B20: Credit to holders of tax credit bonds. Attach Form 8912 | C20: 6k
A21: 6l | B21: Amount on Form 8978, line 14. See instructions | C21: 6l
A22: 6m | B22: Credit for previously owned clean vehicles | C22: 6m
A23: 6z | B23: Other nonrefundable credits. List type and amount ? | C23: 6z
A24: 7 | B24: Total other nonrefundable credits. Add lines 6a through 6z | E24: 7 | F24: of:=SUM([.D10:.D23]) -> 0
A25: 8 | B25: Add lines 1 through 5 and 7. Enter here and on Form 1040, 1040-SR, or 1040-NR, line 20 | E25: 8 | F25: of:=SUM([.F3:.F24]) -> 0
A27: Schedule 3 (Form 1040) 2024 Page 2
A28: Part II Other Payments and Refundable Credits
A29: 9 | B29: Net premium tax credit. Attach Form 8962 | E29: 9
A30: 10 | B30: Amount paid with request for extension to file (see instructions) | E30: 10
A31: 11 | B31: Excess social security and tier 1 RRTA tax withheld | E31: 11
A32: 12 | B32: Credit for federal tax on fuels. Attach Form 4136 | E32: 12
A33: 13. Other payments or refundable credits:
A34: 13a | B34: Form 2439 | C34: 13a
A35: 13b | B35: Section 1341 credit for repayment of amounts included in income from earlier years | C35: 13b
A36: 13c | B36: Net elective payment election amount from Form 3800, Part III, line 6, column i | C36: 13c
A37: 13d | B37: Deferred amount of net 965 tax liability (see instructions) | C37: 13d
A38: 13z | B38: Other refundable credits. List type and amount: | C38: 13z
A39: 14 | B39: Total other payments or refundable credits. Add lines 13a through 13z | E39: 14 | F39: of:=SUM([.D34:.D38]) -> 0
A40: 15 | B40: Add lines 9 through 12 and 14. Enter here and on Form 1040, 1040-SR, or 1040-NR, line 31 | E40: 15 | F40: of:=SUM([.F29:.F39]) -> 0

Sheet: IRS f1040 8812
A1: SCHEDULE 8812 (Form 1040)
A2: Credits for Qualifying Children and Other Dependents
A4: Part I
A5: Child Tax Credit and Credit for Other Dependents
A6: 1 | B6: Enter the amount from line 11 of your Form 1040, 1040-SR, or 1040-NR | I6: 1 | J6: of:=[$'IRS f1040'.J28] -> 0
A7: 2a | B7: Enter income from Puerto Rico that you excluded | G7: 2a
A8: 2b | B8: Enter the amounts from lines 45 and 50 of your Form 2555 | G8: 2b
A9: 2c | B9: Enter the amount from line 15 of your Form 4563 | G9: 2c
A10: 2d | B10: Add lines 2a through 2c | I10: 2d | J10: of:=SUM([.H7:.H9]) -> 0
A11: 3 | B11: Add lines 1 and 2d | I11: 3 | J11: of:=[.J6]+[.J10] -> 0
A12: 4 | B12: Number of qualifying children under age 17 with the required social security number | G12: 4
A13: 5 | B13: Multiply line 4 by $2,000 | I13: 5 | J13: of:=2000*[.H12] -> 0
A14: 6 | B14: Number of other dependents, including any qualifying children who are not under age 17 or who do not have the required social security number | G14: 6
A15: 7 | B15: Multiply line 6 by $500 | I15: 7 | J15: of:=500*[.H14] -> 0
A16: 8 | B16: Add lines 5 and 7 | I16: 8 | J16: of:=[.J13]+[.J15] -> 0
A17: 9 | B17: Enter the amount for your filing status: Married filing jointly$400,000; All other filing statuses$200,000 | I17: 9
A18: 10 | B18: Subtract line 9 from line 3. If zero or less, enter -0-. If more than zero and not a multiple of $1,000, enter the next multiple of $1,000 | I18: 10 | J18: of:=ROUNDUP(MAX([.J11]-[.J17];0);-3) -> 0
A19: 11 | B19: Multiply line 10 by 5% (0.05) | I19: 11 | J19: of:=ROUND([.J18]*0.05;2) -> 0
A20: Is the amount on line 8 more than the amount on line 11?
A21: No. STOP. You cannot take the child tax credit, credit for other dependents, or additional child tax credit. Skip Parts II-A and II-B. Enter -0- on lines 14 and 27.
A22: 12 | B22: Yes. Subtract line 11 from line 8. Enter the result. | I22: 12 | J22: of:=MAX([.J16]-[.J19];0) -> 0
A23: 13 | B23: Enter the amount from the Credit Limit Worksheet A | I23: 13
A24: 14 | B24: Enter the smaller of line 12 or 13. This is your child tax credit and credit for other dependents | I24: 14 | J24: of:=MIN([.J22:.J23]) -> 0
A25: Enter this amount on Form 1040, 1040-SR, or 1040-NR, line 19.
A26: If the amount on line 12 is more than the amount on line 14, you may be able to take the additional child tax credit on Form 1040, 1040-SR, or 1040-NR, line 28. Complete your Form 1040, 1040-SR, or 1040-NR through line 27 (also complete Schedule 3, line 11) before completing Part II-A.
A28: Page 2
A30: Part II-A
A31: Additional Child Tax Credit for All Filers
A32: Caution: If you file Form 2555, you cannot claim the additional child tax credit.
A33: 15 | B33: Check this box if you do not want to claim the additional child tax credit. Skip Parts II-A and II-B. Enter -0- on line 27 | I33: 15
A34: 16a | B34: Subtract line 14 from line 12. If zero, stop here; you cannot take the additional child tax credit. Skip Parts II-A and II-B. Enter -0- on line 27 | I34: 16a | J34: of:=MAX([.J22]-[.J24];0) -> 0
A35: 16b | B35: Number of qualifying children under 17 with the required social security number x $1,700: | G35: 16b | H35: of:=1700*[.H12] -> 0
A36: TIP: The number of children you use for this line is the same as the number of children you used for line 4.
A37: 17 | B37: Enter the smaller of line 16a or line 16b | I37: 17 | J37: of:=MIN([.J34];[.H35]) -> 0
A38: 18a | B38: Earned income (see instructions) | G38: 18a
A39: 18b | B39: Nontaxable combat pay (see instructions) | G39: 18b
A40: Is the amount on line 18a more than $2,500?
A41: No : Leave line 19 blank and enter -0- on line 20.
A42: 19 | B42: YES: Subtract $2,500 from the amount on line 18a | G42: 19 | H42: of:=MAX([.H38]-2500;0) -> 0
A43: 20 | B43: Multiply the amount on line 19 by 15% (0.15) and enter the result | I43: 20 | J43: of:=ROUND(0.15*[.H42];2) -> 0
A44: Next. On line 16b, is the amount $5,100 or more?
A45: No: If you are a bona fide resident of Puerto Rico, go to line 21. Otherwise, skip Part II-B and enter the smaller of line 17 or line 20 on line 27.
A46: Yes: If line 20 is equal to or more than line 17, skip Part II-B and enter the amount from line 17 on line 27. Otherwise, go to line 21.
A48: Part II-B
A49: Certain Filers Who Have Three or More Qualifying Children and Bona Fide Residents of Puerto Rico
A50: 21 | B50: Withheld social security, Medicare, and Additional Medicare taxes from Form(s) W-2, boxes 4 and 6. If married filing jointly, include your spouses amounts with yours. If your employer withheld or you paid Additional Medicare Tax or tier 1 RRTA taxes, see instructions | I50: 21
A51: 22 | B51: Enter the total of the amounts from Schedule 1 (Form 1040), line 15; Schedule 2 (Form 1040), line 5; Schedule 2 (Form 1040), line 6; and Schedule 2 (Form 1040), line 13 | I51: 22
A52: 23 | B52: Add lines 21 and 22 | I52: 23 | J52: of:=[.J51]+[.J50] -> 0
A53: 1040 and 1040-SR filers: Enter the total of the amounts from Form 1040 or 1040-SR, line 27, and Schedule 3 (Form 1040), line 11.
A54: 1040-NR filers: Enter the amount from Schedule 3 (Form 1040), line 11.
A55: 24 | G55: 24
A56: 25 | B56: Subtract line 24 from line 23. If zero or less, enter -0- | I56: 25 | J56: of:=MAX([.J52]-[.H55];0) -> 0
A57: 26 | B57: Enter the larger of line 20 or line 25 | I57: 26 | J57: of:=MAX([.J43];[.J56]) -> 0
A58: Next, enter the smaller of line 17 or line 26 on line 27.
A61: Part II-C
A62: Additional Child Tax Credit
A63: 27 | B63: This is your additional child tax credit. Enter this amount on Form 1040, 1040-SR, or 1040-NR, line 28 | I63: 27 | J63: of:=MAX([.J37];[.J57]) -> 0

Sheet: s8912 Credit Limit Worksheet
A1: SCHEDULE 8812 (Form 1040)
A2: Credit Limit Worksheet A
A3: 1 | B3: Enter the amount from line 18 of your Form 1040, 1040-SR, or 1040-NR. | I3: 1
A4: Add the following amounts (if applicable) from:
A5: 2a | B5: Schedule 3, line 1 | G5: 2a
A6: 2b | B6: Schedule 3, line 2 | G6: 2b
A7: 2c | B7: Schedule 3, line 3 | G7: 2c
A8: 2d | B8: Schedule 3, line 4 | G8: 2d
A9: 2e | B9: Schedule 3, line 5b | G9: 2e
A10: 2f | B10: Schedule 3, line 6d | G10: 2f
A11: 2g | B11: Schedule 3, line 6f | G11: 2g
A12: 2h | B12: Schedule 3, line 6 | G12: 2h
A13: 2i | B13: Schedule 3, line 6m | G13: 2i
A14: 2 | B14: Enter the total. | I14: 2 | J14: of:=SUM([.H5:.H13]) -> 0
A15: 3 | B15: Subtract line 2 from line 1. | I15: 3 | J15: of:=[.J3]-[.J14] -> 0
A16: - Complete Credit Limit Worksheet B only if you meet all the following.
A17: - 1. You are claiming one or more of the following credits.
A18: - a. Mortgage interest credit, Form 8396.
A19: - b. Adoption credit, Form 8839.
A20: - c. Residential clean energy credit, Form 5695, Part I.
A21: - d. District of Columbia first-time homebuyer credit, Form 8859.
A22: - 2. You are not filing Form 2555.
A23: - 3. Line 4 of Schedule 8812 is more than zero.
A24: 4 | B24: If you are not completing Credit Limit Worksheet B, enter -0-; otherwise, enter the amount from Credit Limit Worksheet B. | I24: 4
A25: 5 | B25: Subtract line 4 from line 3. Enter here and on Schedule 8812, line 13. | I25: 5 | J25: of:=[.J15]-[.J24] -> 0

Sheet: Earned Income Worksheet
B1: Earned Income Worksheet
A2: 1a | B2: Enter the amount from line 1z of Form 1040, 1040-SR, or 1040-NR | I2: 1a
A3: 1b | B3: Enter the amount of any nontaxable combat pay received. Also enter this amount on Schedule 8812, line 18b. This amount will be reported either on line 1i of Form 1040 or 1040-SR, or should be shown in Form(s) W-2, box 12, with code Q | I3: 1b
A4: Next, if you are filing Schedule C, F, or SE, or you received a Schedule K-1 (Form 1065), go to line 2a. Otherwise, skip lines 2a through 2e and go to line 3.
A5: 2a | B5: Enter any statutory employee income reported on line 1 of Schedule C | I5: 2a
A6: 2b | B6: Enter any net profit or (loss) from Schedule C, line 31, and Schedule K-1 (Form 1065), box 14, code A (other than farming). Reduce any Schedule K-1 amounts as described in the instructions for completing Schedule SE in the Partner's Instructions for Schedule K-1. Do not include on this line any statutory employee income or any other amounts exempt from self-employment tax. Options and commodities dealers must add any gain or subtract any loss (in the normal course of dealing in or trading section 1256 contracts) from section 1256 contracts or related property | I6: 2b
A7: 2c | B7: Enter any net farm profit or (loss) from Schedule F, line 34, and from farm partnerships, Schedule K-1 (Form 1065), box 14, code A*. Reduce any Schedule K-1 amounts as described in the instructions for completing Schedule SE in the Partner's Instructions for Schedule K-1. Do not include on this line any amounts exempt from self-employment tax | G7: 2c
A8: 2d | B8: If you used the farm optional method to figure net earnings from self-employment, enter the amount from Schedule SE, line 15. Otherwise, skip this line and enter on line 2e the amount from line 2c | G8: 2d
A9: 2e | B9: If line 2c is a profit, enter the smaller of line 2c or line 2d. If line 2c is a (loss), enter the (loss) from line 2c | I9: 2e
A10: 3 | B10: Combine lines 1a, 1b, 2a, 2b, and 2e. If zero or less, stop. Do not complete the rest of this worksheet. Instead, enter -0- on line 3 of Credit Limit Worksheet B or line 18a of Schedule 8812, whichever applies | I10: 3 | J10: of:=SUM([.J2:.J9]) -> 0
A11: 4 | B11: Enter the Medicaid waiver payment amounts excluded from income on Schedule 1 (Form 1040), line 8s, unless you choose to include these amounts in earned income. See the instructions for Schedule 1, line 8s. If you and your spouse both received Medicaid waiver payments during the year, you and your spouse can make different choices about including the full amount of your payments in earned income. Enter only the amount of the Medicaid waiver payments that you or your spouse, if filing a joint return, do not want to include in earned income. To include all nontaxable Medicaid waiver payment amounts in earned income, enter -0- | G11: 4
A12: 5 | B12: Enter the amount from Schedule 1 (Form 1040), line 15 | G12: 5
A13: 6 | B13: Add lines 4 and 5 | I13: 6 | J13: of:=[.H11]+[.H12] -> 0
A14: 7 | B14: Subtract line 6 from line 3 | I14: 7 | J14: of:=[.J10]-[.J13] -> 0
A15: If you were sent here from Credit Limit Worksheet B, enter this amount on line 3 of that worksheet.
A16: If you were sent here from the instructions for line 18a, enter this amount on line 18a of Schedule 8812.
A18: *If you have any Schedule K-1 amounts and you are not required to file Schedule SE, complete the appropriate line(s) of Schedule SE. Put your name and social security number on Schedule SE and attach it to your return.
A20: Additional Medicare Tax and RRTA Tax Worksheet
A21: If your employer withheld or you paid Additional Medicare Tax or Tier 1 RRTA taxes, use this worksheet to figure the amount to enter on line 21 of Schedule 8812 and line 7 of Credit Limit Worksheet B.
A22: Social security tax, Medicare tax, and Additional Medicare Tax on Wages.
A23: 1 | B23: Enter the social security tax withheld (Form(s) W-2, box 4, and Puerto Rico Form(s) 499R-2/W-2PR, box 21) | G23: 1
A24: 2 | B24: Enter the Medicare tax withheld (Form(s) W-2, box 6, and Puerto Rico Form(s) 499R-2/W-2PR, box 23). These boxes include any Additional Medicare Tax withheld | G24: 2
A25: 3 | B25: Enter any amount from Form 8959, line 7 | G25: 3
A26: 4 | B26: Add lines 1, 2, and 3 | G26: 4 | H26: of:=SUM([.H23:.H25]) -> 0
A27: 5 | B27: Enter the Additional Medicare Tax withheld (Form 8959, line 22) | G27: 5
A28: 6 | B28: Subtract line 5 from line 4 | G28: 6 | H28: of:=[.H26]-[.H27] -> 0
A29: Additional Medicare Tax on Self-Employment Income.
A30: 7 | B30: Enter one-half of the Additional Medicare Tax, if any, on self-employment income (one-half of Form 8959, line 13) | G30: 7
A31: Tier 1 RRTA taxes as an employee of a railroad (enter amounts on lines 8, 9, 10, and 11) or employee representative (enter amounts on lines 12, 13, 14, and 15). Do not include amounts in Form W-2, box 14, that are identified as Additional Medicare Tax or Tier 2 tax. Do not include amounts shown on Form CT-2 on line 3 for Additional Medicare Tax or line 4 for Tier 2 tax.
A32: 8 | B32: Enter the Tier 1 tax (Form(s) W-2, box 14) | G32: 8
A33: 9 | B33: Enter the Medicare tax (Form(s) W-2, box 14) | G33: 9
A34: 10 | B34: Enter the Additional Medicare Tax, if any, on RRTA compensation as an employee (Form 8959, line 17). Do not use the same amount from Form 8959, line 17, for both this line 10 and line 14 | G34: 10
A35: 11 | B35: Add lines 8, 9, and 10 | G35: 11 | H35: of:=SUM([.H32:.H34]) -> 0
A36: 12 | B36: Enter one-half of Tier 1 tax (one-half of Forms CT-2, line 1, for all 4 quarters of 2023) | G36: 12
A37: 13 | B37: Enter one-half of Tier 1 Medicare tax (one-half of Forms CT-2, line 2, for all 4 quarters of 2023) | G37: 13
A38: 14 | B38: Enter one-half of the Additional Medicare Tax, if any, on RRTA compensation as an employee representative (one-half of Form 8959, line 17). Do not use the same amount from Form 8959, line 17, for both this line 14 and line 10 | G38: 14
A39: 15 | B39: Add lines 12, 13, and 14 | G39: 15 | H39: of:=SUM([.H36:.H38]) -> 0
A40: Line 21 Amount.
A41: 16 | B41: Add lines 6, 7, 11, and 15. Enter here and on line 21 of Schedule 8812 and, if applicable, line 7 of Credit Limit Worksheet B | G41: 16 | H41: of:=[.H28]+[.H30]+[.H35]+[.H39] -> 0

Sheet: IRS f1040 C
A1: SCHEDULE C (Form 1040) Profit or Loss From Business (Sole Proprietorship)
A2: Name of proprietor
A3: A Principal business or profession, including product or service
A4: Part I Income
A5: 1 | B5: Gross receipts or sales. See instructions for line 1 and check the box if this income was reported to you on Form W-2 and the Statutory employee box on that form was checked | G5: 1
A6: 2 | B6: Returns and allowances | G6: 2
A7: 3 | B7: Subtract line 2 from line 1 | G7: 3 | H7: of:=[.H5]-[.H6] -> 0
A8: 4 | B8: Cost of goods sold (from line 42) | G8: 4 | H8: of:=[.H59] -> 0
A9: 5 | B9: Gross profit. Subtract line 4 from line 3 | G9: 5 | H9: of:=[.H7]-[.H8] -> 0
A10: 6 | B10: Other income, including federal and state gasoline or fuel tax credit or refund (see instructions) | G10: 6
A11: 7 | B11: Gross income. Add lines 5 and 6 | G11: 7 | H11: of:=[.H10]+[.H9] -> 0
A12: Part II Expenses. Enter expenses for business use of your home only on line 30.
A13: 8 | B13: Advertising | G13: 8
A14: 9 | B14: Car and truck expenses (see instructions) | G14: 9
A15: 10 | B15: Commissions and fees | G15: 10
A16: 11 | B16: Contract labor (see instructions) | G16: 11
A17: 12 | B17: Depletion | G17: 12
A18: 13 | B18: Depreciation and section 179 expense deduction (not included in Part III) (see instructions) | G18: 13
A19: 14 | B19: Employee benefit programs (other than on line 19) | G19: 14
A20: 15 | B20: Insurance (other than health) | G20: 15
A21: 16 | B21: Interest (see instructions):
A22: 16a | B22: Mortgage (paid to banks, etc.) | G22: 16a
A23: 16b | B23: Other | G23: 16b
A24: 17 | B24: Legal and professional services | G24: 17
A25: 18 | B25: Office expense (see instructions) | G25: 18
A26: 19 | B26: Pension and profit-sharing plans | G26: 19
A27: 20 | B27: Rent or lease (see instructions):
A28: 20a | B28: Vehicles, machinery, and equipment | G28: 20a
A29: 20b | B29: Other business property | G29: 20b
A30: 21 | B30: Repairs and maintenance | G30: 21
A31: 22 | B31: Supplies (not included in Part III) | G31: 22
A32: 23 | B32: Taxes and licenses | G32: 23
A33: 24 | B33: Travel and meals:
A34: 24a | B34: Travel | G34: 24a
A35: 24b | B35: Deductible meals (see instructions) | G35: 24b
A36: 25 | B36: Utilities | G36: 25
A37: 26 | B37: Wages (less employment credits) | G37: 26
A38: 27a | B38: Other expenses (from line 48) | G38: 27a | H38: of:=[.H75] -> 0
A39: 27b | B39: Reserved for future use | G39: 27b
A40: 28 | B40: Total expenses before expenses for business use of home. Add lines 8 through 27a | G40: 28 | H40: of:=SUM([.H13:.H38]) -> 0
A41: 29 | B41: Tentative profit or (loss). Subtract line 28 from line 7 | G41: 29 | H41: of:=-[.H42] -> -0
A42: 30 | B42: Expenses for business use of your home. Do not report these expenses elsewhere. Attach Form 8829 unless using the simplified method. See instructions. Simplified method filers only: Enter the total square footage of (a) your home: and (b) the part of your home used for business: . Use the Simplified Method Worksheet in the instructions to figure the amount to enter on line 30 | G42: 30
A43: 31 | B43: Net profit or (loss). Subtract line 30 from line 29 | G43: 31 | H43: of:=[.H41]-[.H42] -> -0
B44: If a profit, enter on both Schedule 1 (Form 1040), line 3, and on Schedule SE, line 2. (If you
B45: checked the box on line 1, see instructions). Estates and trusts, enter on Form 1041, line 3.
B46: If a loss, you must go to line 32.
A48: Schedule C (Form 1040) 2021 Page 2
A49: Part III Cost of Goods Sold (see instructions)
A50: 33 | B50: Method(s) used to value closing inventory: a Cost b Lower of cost or market c Other (attach explanation)
A51: 34 | B51: Was there any change in determining quantities, costs, or valuations between opening and closing inventory?
A52: 35 | B52: Inventory at beginning of year. If different from last yearâs closing inventory, attach explanation | G52: 35
A53: 36 | B53: Purchases less cost of items withdrawn for personal use | G53: 36
A54: 37 | B54: Cost of labor. Do not include any amounts paid to yourself | G54: 37
A55: 38 | B55: Materials and supplies | G55: 38
A56: 39 | B56: Other costs | G56: 39
A57: 40 | B57: Add lines 35 through 39 | G57: 40 | H57: of:=SUM([.H52:.H56]) -> 0
A58: 41 | B58: Inventory at end of year | G58: 41
A59: 42 | B59: Cost of goods sold. Subtract line 41 from line 40. Enter the result here and on line 4 | G59: 42 | H59: of:=[.H57]-[.H58] -> 0
A60: Part IV Information on Your Vehicle.
B61: Complete this part only if you are claiming car or truck expenses on line 9 and
B62: are not required to file Form 4562 for this business. See the instructions for line 13 to find out if you must file
B63: Form 4562.
A65: Part V Other Expenses. List below business expenses not included on lines 8-26 or line 30.
A75: 48 | B75: Total other expenses. Enter here and on line 27a | G75: 48 | H75: of:=SUM([.H66:.H74]) -> 0

Sheet: IRS f1040 SE
A1: 2022 Schedule SE Self-Employment Tax
A3: Part I Self-Employment Tax
A5: Note: If your only income subject to self-employment tax is church employee income, see instructions for how to report your income and the definition of church employee income.
A6: A | B6: If you are a minister, member of a religious order, or Christian Science practitioner and you filed Form 4361, but you had $400 or more of other net earnings from self-employment, check here and continue with Part I
A8: Skip lines 1a and 1b if you use the farm optional method in Part II. See instructions.
A9: 1a | B9: Net farm profit or (loss) from Schedule F, line 34, and farm partnerships, Schedule K-1 (Form 1065), box 14, code A | E9: 1a
A10: 1b | B10: If you received social security retirement or disability benefits, enter the amount of Conservation Reserve Program payments included on Schedule F, line 4b, or listed on Schedule K-1 (Form 1065), box 20, code AH | E10: 1b
A11: Skip line 2 if you use the nonfarm optional method in Part II. See instructions.
A12: 2 | B12: Net profit or (loss) from Schedule C, line 31; and Schedule K-1 (Form 1065), box 14, code A (other than farming). | E12: 2
A13: 3 | B13: Combine lines 1a, 1b, and 2 | E13: 3 | F13: of:=SUM([.F9:.F12]) -> 0
A14: 4a | B14: If line 3 is more than zero, multiply line 3 by 92.35% (0.9235). Otherwise, enter amount from line 3 . | E14: 4a | F14: of:=ROUND(IF([.F13]>0;0.9235*[.F13];[.F13]);2) -> 0
A15: Note: If line 4a is less than $400 due to Conservation Reserve Program payments on line 1b, see instructions.
A16: 4b | B16: If you elect one or both of the optional methods, enter the total of lines 15 and 17 here | E16: 4b | F16: of:=[.F39]+[.F44] -> 0
A17: 4c | B17: Combine lines 4a and 4b. If less than $400, stop; you don’t owe self-employment tax. | E17: 4c | F17: of:=[.F14]+[.F16] -> 0
A18: Exception: If less than $400 and you had church employee income, enter -0- and continue.
A19: 5a | B19: Enter your church employee income from Form W-2. See instructions for definition of church employee income | C19: 5a | F19: of:=ROUND([.D19]*0.9235;2) -> 0
A20: 5b | B20: Multiply line 5a by 92.35% (0.9235). If less than $100, enter -0- | E20: 5b | F20: of:=IF([.F19]<100;0;[.F19]) -> 0
A21: 6 | B21: Add lines 4c and 5b | E21: 6 | F21: of:=[.F17]+[.F20] -> 0
A22: 7 | B22: Maximum amount of combined wages and self-employment earnings subject to social security tax | E22: 7 | F22: 168600
A23: or the 6.2% portion of the 7.65% railroad retirement (tier 1) tax for 2020
A24: 8a | B24: Total social security wages and tips (total of boxes 3 and 7 on Form(s) W-2) and railroad retirement (tier 1) compensation. If $147,000 or more, skip lines 8b through 10, and go to line 11 | C24: 8a
A25: 8b | B25: Unreported tips subject to social security tax from Form 4137, line 10 | C25: 8b
A26: 8c | B26: Wages subject to social security tax from Form 8919, line 10 | C26: 8c
A27: 8d | B27: Add lines 8a, 8b, and 8c | E27: 8d | F27: of:=SUM([.D24:.D26]) -> 0
A28: 9 | B28: Subtract line 8d from line 7. If zero or less, enter -0- here and on line 10 and go to line 11 | E28: 9 | F28: of:=[.F22]-[.F27] -> 168600
A29: 10 | B29: Multiply the smaller of line 6 or line 9 by 12.4% (0.124) | E29: 10 | F29: of:=ROUND(0.124 * MIN([.F21];[.F28]); 2) -> 0
A30: 11 | B30: Multiply line 6 by 2.9% (0.029) | E30: 11 | F30: of:=ROUND(0.029*[.F21];2) -> 0
A31: 12 | B31: Self-employment tax. Add lines 10 and 11. Enter here and on Schedule 2 (Form 1040), line 4 | E31: 12 | F31: of:=[.F30]+[.F29] -> 0
A32: 13 | B32: Deduction for one-half of self-employment tax. Multiply line 12 by 50% (0.50). Enter here and on Schedule 1 (Form 1040), line 14 | C32: 13 | D32: of:=ROUND([.F31]/2;2) -> 0
A34: Part II Optional Methods To Figure Net Earnings (see instructions)
A35: Farm Optional Method. You may use this method only if (a) your gross farm income 1 wasn’t more than
A36: $8,460, or (b) your net farm profits 2 were less than $6,107.
A38: 14 | B38: Maximum income for optional methods | E38: 14 | F38: 6560
A39: 15 | B39: Enter the smaller of: two-thirds ( 2 / 3 ) of gross farm income (not less than zero) or $5,640. Also, include this amount on line 4b above | E39: 15
A40: Nonfarm Optional Method. You may use this method only if (a) your net nonfarm profits 3 were less than $6,107
A41: and also less than 72.189% of your gross nonfarm income, 4 and (b) you had net earnings from self-employment
A42: of at least $400 in 2 of the prior 3 years. Caution: You may use this method no more than five times.
A43: 16 | B43: Subtract line 15 from line 14 | E43: 16 | F43: of:=[.F38]-[.F39] -> 6560
A44: 17 | B44: Enter the smaller of: two-thirds ( 2 / 3 ) of gross nonfarm income 4 (not less than zero) or the amount on line 16. Also, include this amount on line 4b above | E44: 17

Sheet: New York IT203
A1: IT-203 - Nonresident and Part-Year Resident Income Tax Return
A2: Page 2 of 4 IT-203 (2020)
C3: Federal Amount | E3: NY Amount
A4: 1 | B4: Wages, salaries, tips, etc. | C4: 1 | E4: 1
A5: 2 | B5: Taxable interest income | C5: 2 | E5: 2
A6: 3 | B6: Ordinary dividends | C6: 3 | E6: 3
A7: 4 | B7: Taxable refunds, credits, or offsets of state and local income taxes (also enter on line 24) | C7: 4 | E7: 4
A8: 5 | B8: Alimony received | C8: 5 | E8: 5
A9: 6 | B9: Business income or loss (submit a copy of federal Sch. C or C-EZ, Form 1040) | C9: 6 | E9: 6
A10: 7 | B10: Capital gain or loss (if required, submit a copy of federal Sch. D, Form 1040) | C10: 7 | E10: 7
A11: 8 | B11: Other gains or losses (submit a copy of federal Form 4797) | C11: 8 | E11: 8
A12: 9 | B12: Taxable amount of IRA distributions. Beneficiaries: mark X in box | C12: 9 | E12: 9
A13: 10 | B13: Taxable amount of pensions/annuities. Beneficiaries: mark X in box | C13: 10 | E13: 10
A14: 11 | B14: Rental real estate, royalties, partnerships, S corporations, trusts, etc. (submit a copy of federal Schedule E, Form 1040) | C14: 11 | E14: 11
A15: 12 | B15: Rental real estate included in line 11 (federal amount) | C15: 12
A16: 13 | B16: Farm income or loss (submit a copy of federal Sch. F, Form 1040) | C16: 13 | E16: 13
A17: 14 | B17: Unemployment compensation | C17: 14 | E17: 14
A18: 15 | B18: Taxable amount of social security benefits (also enter on line 26). | C18: 15 | E18: 15
A19: 16 | B19: Other income (see page 22) Identify: | C19: 16 | E19: 16
A20: 17 | B20: Add lines 1 through 11 and 13 through 16 | C20: 17 | D20: of:=SUM([.D4:.D14])+SUM([.D16:.D19]) -> 0 | E20: 17 | F20: of:=SUM([.F4:.F14])+SUM([.F16:.F19]) -> 0
A21: 18 | B21: Total federal adjustments to income (see page 22) Identify: | C21: 18 | E21: 18
A22: 19 | B22: Federal adjusted gross income (subtract line 18 from line 17) | C22: 19 | D22: of:=[.D20]-[.D21] -> 0 | E22: 19 | F22: of:=[.F20]-[.F21] -> 0
A23: 19a | B23: Recomputed federal adjusted gross income (see page 255, line 19a worksheet) | C23: 19a | D23: of:=[.D22] -> 0 | E23: 19a | F23: of:=[.F22] -> 0
A24: 20 | B24: Interest income on state and local bonds (but not those of New York State or its localities) | C24: 20 | E24: 20
A25: 21 | B25: Public employee 414(h) retirement contributions | C25: 21 | E25: 21
A26: 22 | B26: Other (Form IT-225, line 9) | C26: 22 | E26: 22
A27: 23 | B27: Add lines 19a through 22 | C27: 23 | D27: of:=SUM([.D23:.D26]) -> 0 | E27: 23 | F27: of:=SUM([.F23:.F26]) -> 0
A28: 24 | B28: Taxable refunds, credits, or offsets of state and local income taxes (from line 4) | C28: 24 | D28: of:=[.D7] -> 0 | E28: 24 | F28: of:=[.F7] -> 0
A29: 25 | B29: Pensions of NYS and local governments and the federal government (see page 24) | C29: 25 | E29: 25
A30: 26 | B30: Taxable amount of social security benefits (from line 15) | C30: 26 | E30: 26
A31: 27 | B31: Interest income on U.S. government bonds | C31: 27 | E31: 27
A32: 28 | B32: Pension and annuity income exclusion | C32: 28 | E32: 28
A33: 29 | B33: Other (Form IT-225, line 18) | C33: 29 | E33: 29
A34: 30 | B34: Add lines 24 through 29 | C34: 30 | D34: of:=SUM([.D28:.D33]) -> 0 | E34: 30 | F34: of:=SUM([.F28:.F33]) -> 0
A35: 31 | B35: New York adjusted gross income (subtract line 30 from line 23). | C35: 31 | D35: of:=[.D27]-[.D34] -> 0 | E35: 31 | F35: of:=[.F27]-[.F34] -> 0
A36: 32 | B36: Enter the amount from line 31, Federal amount column | E36: 32 | F36: of:=[.D35] -> 0
A37: 33 | B37: Enter your standard deduction or your itemized deduction | E37: 33
A38: 34 | B38: Subtract line 33 from line 32 (if line 33 is more than line 32, leave blank) | E38: 34 | F38: of:=[.F36]-[.F37] -> 0
A39: 35 | B39: Dependent exemptions (enter the number of dependents listed in Item I; see page 26) | E39: 35
A40: 36 | B40: New York taxable income (subtract line 35 from line 34) | E40: 36 | F40: of:=[.F38]-[.F39] -> 0
A42: Tax computation, credits and other taxes
A43: 37 | B43: New York taxable income (from line 36 on page 2) | E43: 37 | F43: of:=[.F40] -> 0
A44: 38 | B44: New York State tax on line 37 amount (see page 27 and Tax computation on pages 60,61, and 62) | E44: 38
A45: 39 | B45: New York State household credit (page 27, table 1, 2, or 3) | E45: 39
A46: 40 | B46: Subtract line 39 from line 38 (if line 39 is more than line 38, leave blank) | E46: 40 | F46: of:=IF([.F44] > [.F45];[.F44]-[.F45];0) -> 0
A47: 41 | B47: New York State child and dependent care credit (see page 28) | E47: 41
A48: 42 | B48: Subtract line 41 from line 40 (if line 41 is more than line 40, leave blank) | E48: 42 | F48: of:=[.F46]-[.F47] -> 0
A49: 43 | B49: New York State earned income credit (see page 28) | E49: 43
A50: 44 | B50: Base tax (subtract line 43 from line 42; if line 43 is more than line 42, leave blank) | E50: 44 | F50: of:=IF([.F48]>[.F49];[.F48]-[.F49];0) -> 0
B51: New York State amount from line 31 | D51: of:=[.F35] -> 0
B52: Federal amount from line 31 | D52: of:=[.D35] -> 0
A53: 45 | B53: Round result to 4 decimal places percentage .00 / .00 | E53: 45 | F53: of:=ROUND(IF([.D52]<>0;[.D51]/[.D52];0);4) -> 0
A54: 46 | B54: Allocated New York State tax (multiply line 44 by the decimal on line 45) | E54: 46 | F54: of:=ROUND([.F50]*[.F53];0) -> 0
A55: 47 | B55: New York State nonrefundable credits (Form IT-203-ATT, line 8) | E55: 47
A56: 48 | B56: Subtract line 47 from line 46 (if line 47 is more than line 46, leave blank) | E56: 48 | F56: of:=IF([.F54]>[.F55];[.F54]-[.F55];0) -> 0
A57: 49 | B57: Net other New York State taxes (Form IT-203-ATT, line 33) | E57: 49
A58: 50 | B58: Total New York State taxes (add lines 48 and 49) | E58: 50 | F58: of:=[.F56]+[.F57] -> 0
A59: 51 | B59: Part-year New York City resident tax (Form IT-360.1) | C59: 51
A60: 52 | B60: Part-year resident nonrefundable New York City child and dependent care credit | C60: 52
A61: 52a | B61: Subtract line 52 from 51 | C61: 52a | D61: of:=[.D59]-[.D60] -> 0
A62: 52b | B62: MCTMT net earnings base | C62: 52b
A63: 52c | B63: MCTMT | C63: 52c
A64: 53 | B64: Yonkers nonresident earnings tax (Form Y-203) | C64: 53
A65: 54 | B65: Part-year Yonkers resident income tax surcharge (Form IT-360.1) | C65: 54
A66: 55 | B66: Total New York City and Yonkers taxes (add lines 52a, 53, and 54) | E66: 55 | F66: of:=[.D61]+[.D64]+[.D65] -> 0
A67: 56 | B67: Sales or use tax (See the instructions on page 29. Do not leave line 56 blank.) | E67: 56
A68: 57 | B68: Total voluntary contributions (Form IT-227, Part 2, line 1) | E68: 57
A69: 58 | B69: Total New York State, New York City, and Yonkers taxes, sales or use tax, and voluntary contributions (add lines 50, 55, 56, and 57) | E69: 58 | F69: of:=[.F58]+[.F66]+[.F67]+[.F68] -> 0
A70: 59 | B70: Enter the amount from line 58 | E70: 59 | F70: of:=[.F69] -> 0
A71: 60 | B71: Part-year NYC school tax credit (also complete E on front; see page 31) | C71: 60
A72: 60a | B72: NYC school tax credit (rate reduction amount) | C72: 60a
A73: 61 | B73: Other refundable credits (Form IT-203-ATT, line 17) | C73: 61
A74: 62 | B74: Total New York State tax withheld | C74: 62
A75: 63 | B75: Total New York City tax withheld | C75: 63
A76: 64 | B76: Total Yonkers tax withheld | C76: 64
A77: 65 | B77: Total estimated tax payments/amount paid with Form IT-370 | C77: 65
A78: 66 | B78: Total payments and refundable credits (add lines 60 through 65) | E78: 66 | F78: of:=SUM([.D71:.D77]) -> 0
A79: 67 | B79: Amount overpaid (if line 66 is more than line 59, subtract line 59 from line 66) | E79: 67 | F79: of:=IF([.F78]>[.F70];[.F78]-[.F70];0) -> 0
A80: 68 | B80: Amount of line 67 available for refund | E80: 68 | F80: of:=[.F79]-[.D83] -> 0
A81: 68a | B81: Amount of line 68 that you want to deposit into a NYS 529 account | E81: 68a
A82: 68b | B82: Total refund after NYS 529 account deposit | E82: 68b | F82: of:=[.F80]-[.F81] -> 0
A83: 69 | B83: Amount of line 67 that you want applied to your 2015 estimated tax (see instructions) | C83: 69
A84: 70 | B84: Amount you owe (if line 66 is less than line 59, subtract line 66 from line 59). | E84: 70 | F84: of:=MAX([.F70]-[.F78];0) -> 0
A85: 71 | B85: Estimated tax penalty (include this amount on line 70, or reduce the overpayment on line 67; see page 33) | C85: 71
A86: 72 | B86: Other penalties and interest (see page 33) | C86: 72

Sheet: PA 40
A2: Pennsylvania Income Tax Return
A3: PA Department of Revenue, Harrisburg, PA 17129
A5: of:="1a." -> 1a. | B5: Gross Compensation. Do not include exempt income, such as combat zone pay and qualifying retirement benefits. See the instructions. | C5: of:="1a." -> 1a.
A6: of:="1b." -> 1b. | B6: Unreimbursed Employee Business Expenses. | C6: of:="1b." -> 1b.
A7: of:="1c." -> 1c. | B7: Net Compensation. Subtract Line 1b from Line 1a. | C7: of:="1c." -> 1c. | D7: of:=[.D5]-[.D6] -> 0
A8: of:="2." -> 2. | B8: Interest Income. Complete PA Schedule A if required. | C8: of:="2." -> 2.
A9: of:="3." -> 3. | B9: Dividend and Capital Gains Distributions Income. Complete PA Schedule B if required. | C9: of:="3." -> 3.
A10: of:="4." -> 4. | B10: Net Income or Loss from the Operation of a Business, Profession or Farm. | C10: of:="4." -> 4.
A11: of:="5." -> 5. | B11: Net Gain or Loss from the Sale, Exchange or Disposition of Property. | C11: of:="5." -> 5.
A12: of:="6." -> 6. | B12: Net Income or Loss from Rents, Royalties, Patents or Copyrights. | C12: of:="6." -> 6.
A13: of:="7." -> 7. | B13: Estate or Trust Income. Complete and submit PA Schedule J. | C13: of:="7." -> 7.
A14: of:="8." -> 8. | B14: Gambling and Lottery Winnings. Complete and submit PA Schedule T. | C14: of:="8." -> 8.
A15: of:="9." -> 9. | B15: Total PA Taxable Income. Add only the positive income amounts from Lines 1c, 2, 3, 4, 5, 6, 7 and 8. DO NOT ADD any losses reported on Lines 4, 5 or 6. | C15: of:="9." -> 9. | D15: of:=SUM([.D7:.D14]) -> 0
A16: of:="10." -> 10. | B16: Other Deductions. Enter the appropriate code for the type of deduction. See the instructions for additional information. | C16: of:="10." -> 10.
A17: of:="11." -> 11. | B17: Adjusted PA Taxable Income. Subtract Line 10 from Line 911. | C17: of:="11." -> 11. | D17: of:=[.D15]-[.D16] -> 0
A18: of:="12." -> 12. | B18: PA Tax Liability. Multiply Line 11 by 3.07 percent (0.0307). | C18: of:="12." -> 12. | D18: of:=0.0307*[.D17] -> 0
A19: of:="13." -> 13. | B19: Total PA Tax Withheld. See the instructions. | C19: of:="13." -> 13.
A20: of:="14." -> 14. | B20: Credit from last year's PA Income Tax return. | C20: of:="14." -> 14.
A21: of:="15." -> 15. | B21: This Year's Estimated Installment Payments. Fill in oval if including Form REV-459B. | C21: of:="15." -> 15.
A22: of:="16." -> 16. | B22: This Year's Extension Payment. | C22: of:="16." -> 16.
A23: of:="17." -> 17. | B23: Nonresident Tax Withheld from your PA Schedule(s) NRK-1. (Nonresidents only) . | C23: of:="17." -> 17.
A24: of:="18." -> 18. | B24: Total Estimated Payments and Credits. Add Lines 14, 15, 16 and 17. | C24: of:="18." -> 18. | D24: of:=SUM([.D20:.D23]) -> 0
A25: Tax Forgiveness Credit, submit PA Schedule SP
A26: of:="19a." -> 19a. | B26: Dependents, Part B, Line 2, PA Schedule SP. | C26: of:="19a." -> 19a.
A27: of:="20." -> 20. | B27: Total Eligibility Income from Part C, Line 11, PA Schedule SP. . | C27: of:="20." -> 20.
A28: of:="21." -> 21. | B28: Tax Forgiveness Credit from Part D, Line 16, PA Schedule SP. | C28: of:="21." -> 21.
A29: of:="22." -> 22. | B29: Resident Credit. Submit your PA Schedule(s) G-L and/or RK-1. | C29: of:="22." -> 22.
A30: of:="23." -> 23. | B30: Total Other Credits. Submit your PA Schedule OC. | C30: of:="23." -> 23.
A31: of:="24." -> 24. | B31: TOTAL PAYMENTS and CREDITS. Add Lines 13, 18, 21, 22 and 23. | C31: of:="24." -> 24. | D31: of:=[.D19]+[.D24]+SUM([.D28:.D30]) -> 0
A32: of:="25." -> 25. | B32: USE TAX. Due on internet, mail order or out-of-state purchases. See the instructions. 25. | C32: of:="25." -> 25.
A33: of:="26." -> 26. | B33: TAX DUE. If the total of Line 12 and Line 25 is more than Line 24, enter the difference here. | C33: of:="26." -> 26. | D33: of:=IF([.D18]+[.D32]>[.D31];[.D18]+[.D32]-[.D31];0) -> 0
A34: of:="27." -> 27. | B34: Penalties and Interest. See the instructions for additional information. Fill in oval if including Form REV-1630/REV-1630A . | C34: of:="27." -> 27.
A35: of:="28." -> 28. | B35: TOTAL PAYMENT DUE. See the instructions. | C35: of:="28." -> 28.
A36: of:="29." -> 29. | B36: OVERPAYMENT. If Line 24 is more than the total of Line 12, Line 25 and Line 27 enter the difference here. | C36: of:="29." -> 29. | D36: of:=IF([.D31]>[.D18]+[.D32]+[.D34];[.D31]-([.D18]+[.D32]+[.D34]);0) -> 0
A37: of:="30." -> 30. | B37: Refund -- Amount of Line 29 you want as a check mailed to you.REFUND | C37: of:="30." -> 30.
A38: The total of Lines 30 through 36 must equal Line 29.
A39: of:="31." -> 31. | B39: Credit -- Amount of Line 29 you want as a credit to your 2015 estimated account. | C39: of:="31." -> 31. | D39: of:=[.D36]-[.D37] -> 0
A40: of:="32." -> 32. | B40: Refund donation line. Enter the organization code and donation amount. | C40: of:="32." -> 32. | D40: of:=[.D36]-[.D37]-[.D39] -> 0
A41: of:="33." -> 33. | B41: Refund donation line. Enter the organization code and donation amount. | C41: of:="33." -> 33. | D41: of:=[.D39]-[.D40] -> 0
A42: of:="34." -> 34. | B42: Refund donation line. Enter the organization code and donation amount. | C42: of:="34." -> 34. | D42: of:=[.D40]-[.D41] -> 0
A43: of:="35." -> 35. | B43: Refund donation line. Enter the organization code and donation amount. | C43: of:="35." -> 35. | D43: of:=[.D41]-[.D42] -> 0
A44: of:="36." -> 36. | B44: Refund donation line. Enter the organization code and donation amount. | C44: of:="36." -> 36. | D44: of:=[.D42]-[.D43] -> 0

Sheet: PA-40 G-L
A1: PA-40 G-L
A2: Name of taxpayer claiming the credit
A4: Part I - Calculation of Credit for Taxes Paid to Other States
C5: A | D5: B | E5: C
A6: I.1. | B6: Name of other state
A7: I.2. | B7: Class of income subject to tax in the other state | C7: PA | D7: other state
A8: I.2a. | B8: Compensation | C8: 0 | D8: 0
A9: I.2b. | B9: Unreimbursed business expenses | C9: 0
A10: I.2c. | B10: Net compensation | C10: 0 | D10: 0 | E10: of:=MIN([.C10:.D10]) -> 0
A11: I.2d. | B11: Interest | C11: 0 | D11: 0 | E11: of:=MIN([.C11:.D11]) -> 0
A12: I.2e. | B12: Dividends | C12: 0 | D12: 0 | E12: of:=MIN([.C12:.D12]) -> 0
A13: I.2f. | B13: Net income or loss from business, profession or farm | C13: 0 | D13: 0 | E13: of:=MIN([.C13:.D13]) -> 0
A14: I.2g. | B14: Gain or loss from sale, exchange or disposition of property | C14: 0 | D14: 0 | E14: of:=MIN([.C14:.D14]) -> 0
A15: I.2h. | B15: Income or Loss from rents, royalties, patents and copyrights | C15: 0 | D15: 0 | E15: of:=MIN([.C15:.D15]) -> 0
A16: I.2i. | B16: Estate or trust income | C16: 0 | D16: 0 | E16: of:=MIN([.C16:.D16]) -> 0
A17: I.2j. | B17: Gambling and lottery winnings | C17: 0 | D17: 0 | E17: of:=MIN([.C17:.D17]) -> 0
A18: I.3. | B18: Income subject to tax in the other state - Add Lines 2c thru 2j for Column C. Enter the result here. | E18: of:=SUM([.E10:.E17]) -> 0
A19: I.4a. | B19: a. Tax due or assessed in the other state | E19: 0
A20: I.4b. | B20: Tax paid in the other state | E20: 0
A21: I.4c. | B21: Enter the lesser of Line 4a or Line 4b | E21: of:=MIN([.E19:.E20]) -> 0
A22: I.4d. | B22: Less: adjustments - Enter the amount from Part III, Line 5. | E22: of:=pIII5 -> 
A23: I.4e. | B23: Adjusted tax paid in the other state - Subtract Line 4d from Line 4c. Enter the result here. | E23: of:=[.E21]-[.E22] -> 
A24: I.5. | B24: Line 3 x 3.07 percent (0.0307) | E24: of:=ROUND([.E18] * 0.0307;2) -> 0
A25: I.6. | B25: PA Resident Credit. Enter the lesser of Line 4e or Line 5 here and on the appropriate form (see instructions). | E25: of:=MIN([.E23:.E24]) -> 
A27: Part II - Worksheet for Sources and Amounts of Income Subject to Tax in the Other State
A28: >> | B28: Columns | C28: A | D28: B | E28: C | F28: D | G28: E
A29: II.1. | B29: Source entity name | C29: 0 | D29: 0 | E29: 0 | F29: 0 | G29: TOTALS
A30: II.2. | B30: Income by class
A31: II.2.a. | B31: Compensation | C31: 0 | D31: 0 | E31: 0 | F31: 0 | G31: of:=SUM([.C31:.F31]) -> 0
A32: II.2.b. | B32: Interest | C32: 0 | D32: 0 | E32: 0 | F32: 0 | G32: of:=SUM([.C32:.F32]) -> 0
A33: II.2.c. | B33: Dividends | C33: 0 | D33: 0 | E33: 0 | F33: 0 | G33: of:=SUM([.C33:.F33]) -> 0
A34: II.2.d. | B34: Net income or loss from business, profession or farm | C34: 0 | D34: 0 | E34: 0 | F34: 0 | G34: of:=SUM([.C34:.F34]) -> 0
A35: II.2.e. | B35: Gain or loss from sale, exchange or disposition of property | C35: 0 | D35: 0 | E35: 0 | F35: 0 | G35: of:=SUM([.C35:.F35]) -> 0
A36: II.2.f. | B36: Income or loss from rents, royalties, patents and copyrights | C36: 0 | D36: 0 | E36: 0 | F36: 0 | G36: of:=SUM([.C36:.F36]) -> 0
A37: II.2.g. | B37: Estate or trust income | C37: 0 | D37: 0 | E37: 0 | F37: 0 | G37: of:=SUM([.C37:.F37]) -> 0
A38: II.2.h. | B38: Gambling and lottery winnings | C38: 0 | D38: 0 | E38: 0 | F38: 0 | G38: of:=SUM([.C38:.F38]) -> 0
A40: Part III - Worksheet for Adjusted Tax Paid in the Other State
A41: III.1. | B41: Enter the amount from Part I, Column C, Line 3 here. | C41: of:=[.E18] -> 0
A42: III.2. | B42: Add the amounts from Part I, Column B, Lines 2c through 2j. Enter the result here. | C42: of:=SUM([.D10:.D17]) -> 0
A43: III.3. | B43: Divide the amount from Part III, Line 1 by Part III, Line 2. Enter the result here (calculate to six decimal places). | C43: of:=ROUND([.C41]/[.C42];6) -> 
B44: If the amount on Part III, Line 3 equals 1.000000, you may stop here and enter "0" on Part I, Line 4d.
A45: III.4. | B45: If the amount on Part III, Line 3 is less than 1.000000, subtract the decimal from 1.000000. | C45: of:=1 - [.C43] -> 
A46: III.5. | B46: Multiply the decimal on Part III, Line 4 by the amount on Part I, Line 4c. Enter the result here and on Part I, Line 4d. | C46: of:=ROUND([.C45] * [.E21];2) -> 

Sheet: Local
B1: Local Tax Worksheet
D2: You | E2: Your Spouse
B3: Names
A4: 1. | B4: Gross Compensation as Reported on W-2(s). (Enclose W-2(s)) | C4: 1. | D4: 0 | E4: 0
A5: 2. | B5: Unreimbursed Employee Business Expenses. (Enclose PA Schedule UE) | C5: 2. | D5: 0 | E5: 0
A6: 3. | B6: Other Taxable Earned Income * | C6: 3. | D6: 0 | E6: 0
A7: 4. | B7: Total Taxable Earned Income (Subtract Line 2 from Line 1 and add Line 3) | C7: 4. | D7: of:=[.D4]+[.D6]-[.D5] -> 0 | E7: of:=[.E4]+[.E6]-[.E5] -> 0
A8: 5. | B8: Net Profit (Enclose PA Schedules*) | C8: 5. | D8: 0 | E8: 0
A9: 6. | B9: Net Loss (Enclose PA Schedules*) | C9: 6. | D9: 0 | E9: 0
A10: 7. | B10: Total Taxable Net Profit (Subtract Line 6 from Line 5. If less than zero, enter zero) | C10: 7. | D10: of:=MAX([.D8]-[.D9];0) -> 0 | E10: of:=MAX([.E8]-[.E9];0) -> 0
A11: 8. | B11: Total Taxable Earned Income and Net Profit (Add Lines 4 and 7) | C11: 8. | D11: of:=[.D7]+[.D10] -> 0 | E11: 0
B12: Tax Rate | D12: 0.0307 | E12: of:=[.D12] -> 0.0307
A13: 9. | B13: Total Tax Liability (Line 8 multiplied by tax rate) | C13: 9. | D13: of:=[.D11]*[.D12] -> 0 | E13: of:=[.E11]*[.E12] -> 0
A14: 10. | B14: Total Local Earned Income Tax Withheld (MAY NOT EQUAL W-2 - SEE INSTRUCTIONS)* | C14: 10. | D14: 0 | E14: 0
A15: 11. | B15: Quarterly Estimated Payments/Credit From Previous Tax Year | C15: 11. | D15: 0 | E15: 0
A16: 12. | B16: Out of State or Philadelphia credits* (include supporting documentation) | C16: 12. | D16: of:=[.D34] -> 0 | E16: of:=[.E34] -> 0
A17: 13. | B17: TOTAL PAYMENTS and CREDITS (Add lines 10 through 12) | C17: 13. | D17: of:=SUM([.D14:.D16]) -> 0 | E17: of:=SUM([.E14:.E16]) -> 0
B18: Overpayment | D18: of:=IF([.D17]>[.D13];[.D17]-[.D13];0) -> 0 | E18: of:=IF([.E17]>[.E13];[.E17]-[.E13];0) -> 0
A19: 14. | B19: Refund IF MORE THAN $1.00, enter amount (or select option in 15) | C19: 14. | D19:    
A20: 15. | B20: Credit Taxpayer/Spouse (Amount of Line 14 you want as a credit to your account) | C20: 15. | D20:    
A21: 16. | B21: EARNED INCOME TAX BALANCE DUE (Line 9 minus Line 13) | C21: 16. | D21: of:=IF([.D13]>[.D17];[.D13]-[.D17];0) -> 0 | E21: of:=IF([.E13]>[.E17];[.E13]-[.E17];0) -> 0
A22: 17. | B22: Penalty after April 15* (Multiply line 16 by 0.01 x number of months late-or a fraction of) | C22: 17. | D22:    
A23: 18. | B23: Interest after April 15* Multiply line 16 by 0.00246 x number of months late-or a fraction of) | C23: 18. | D23:    
A24: 19. | B24: TOTAL PAYMENT DUE (Add Lines 16, 17, and 18) Payable to HAB-EIT | C24: 19. | D24: of:=SUM([.D21:.D23]) -> 0 | E24: of:=SUM([.E21:.E23]) -> 0
A26: NON-RECIPROCAL STATE WORKSHEET (See Instructions line 12)
A27: NR1 | B27: EARNED INCOME: Taxed in other state as shown on the state tax return. Enclose a copy of state return or credit will be disallowed | D27: 0 | E27: 0
B28: Local tax 1% or Act 511 portion of rate | D28: of:=[.D12] -> 0.0307 | E28: of:=[.E12] -> 0.0307
A29: NR2 | B29: Local Tax | D29: of:=[.D27]*[.D28] -> 0 | E29: of:=[.E27]*[.E28] -> 0
A30: NR3 | B30: Tax Liability Paid to other state(s) | D30: 0 | E30: 0
B31: PA Income Tax Rate | D31: 0.0307 | E31: of:=[.D31] -> 0.0307
A32: NR4 | B32: PA Income Tax (line 1 x PA Income Tax rate for year being reported) | D32: of:=[.D31]*[.D27] -> 0 | E32: of:=[.E31]*[.E27] -> 0
A33: NR5 | B33: CREDIT to be used against Local Tax (Line 3 minus line 4) | D33: of:=[.D30]-[.D32] -> 0 | E33: of:=[.E30]-[.E32] -> 0
B34: Amount to enter on line 2 | D34: of:=MAX(MIN([.D29];[.D33]);0) -> 0 | E34: of:=MAX(MIN([.E29];[.E33]);0) -> 0
A36: On line 12 enter this amount or the amount on line 2 of worksheet, whichever is less. (If less than zero, enter zero)